activity_id,activity_title,activity_description,activity_instructions,input_needed,activity_benefit
1,Vier je succes,None,"Deze oefening heet Vier je succes. Het is belangrijk om jezelf te belonen, want je bent goed bezig! Jezelf belonen helpt om gezonder te blijven leven zoals je nu doet. Daarom wil ik het vandaag hebben over het vieren van succes. Jouw eerste wandeling of eerste rookvrije dag is zeker een beloning waard! Elke stap in de goede richting is namelijk belangrijk. Beloon jezelf daarom voor stappen die je helpen met stoppen met roken en meer bewegen. Jezelf belonen kan op verschillende manieren. Denk aan; een goed boek, nieuwe kleren, een dagje weg, een bosje bloemen, of naar de bioscoop gaan. Door te stoppen met roken bespaar je geld, dus dit kun je gebruiken om jezelf te belonen! Een beloning hoeft niet altijd geld te kosten; zo kun je altijd een rondje lopen of even lekker gaan sporten. Laten we eens nadenken over jouw succes. Denk na over hoe jij jezelf voor je volgende succes gaat belonen. Welk succes is dat? En hoe beloon je jezelf? Je kunt denken aan de voorbeelden die ik net gaf, maar er zijn natuurlijk nog veel meer beloningen. Heb je iets bedacht? Schrijf dit op een briefje of zet het in de notities van je telefoon. Wees trots op de stappen die je zet en vier jouw volgende succes zoals je net hebt opgeschreven!",0,"te vieren wat je al hebt bereikt, zodat je het volhoudt."
2,Doe het anders,None,"Deze oefening heet Doe het anders. Je zult soms zin hebben in een sigaret, maar meestal duurt dit maar een paar minuten. Het is belangrijk om van te voren te bedenken wat je zou kunnen doen als je zin hebt in een sigaret. Deze oefening helpt hierbij. Bedenk hoe je jezelf bezig kunt houden wanneer je zin hebt om te roken, zodat je dan juist NIET gaat roken. Probeer iets te gaan doen wat net zo lang duurt tot de zin om te roken weer weg is. Je kunt bijvoorbeeld je planten water geven, fruit schillen, snijden en opeten, of een kopje thee zetten. Ook kun je iets sportiefs doen op zo’n moment. Bijvoorbeeld een (klein) rondje lopen of fietsen, een video op YouTube kijken met een (makkelijke) sportieve oefening van een paar minuten, een rek en strek oefening doen of een paar keer de trap op en af lopen. Op deze manier zit je minder, beweeg je meer én het kan helpen om niet te roken als je zin hebt in een sigaret. Maak een lijstje van dingen die je kunt doen in plaats van roken. Bepaal daarna wat je de volgende keer als eerste zou willen proberen.",1,roken te voorkomen.
3,Advies voor bewegen,None,"Deze leesoefening heet Advies voor bewegen. Stoppen met roken wordt makkelijker wanneer je meer lichamelijk actief bent. Het komt veel voor dat mensen te weinig bewegen op een dag, bijvoorbeeld omdat zij veel achter een computer zitten. Weinig bewegen en veel zitten is niet zo goed voor je gezondheid. Zelfs als je op een dag 1 uur hebt gesport is het belangrijk om de rest van de dag niet alleen maar de zitten. Als je de rest van de dag alleen maar zit, dan kun je alsnog last krijgen van gezondheidsproblemen. Maar wanneer beweeg je genoeg? In de volgende video van 3 minuten wordt uitleg gegeven over voldoende bewegen (https://www.youtube.com/watch?v=B_SbTACva3o). Het advies is om elke week minimaal 2.5 uur matig intensief OF 1 uur en 15 minuten intensief actief te zijn. Wanneer je dit verdeelt over de week, probeer dan steeds minimaal 10 minuten actief te zijn. Bijvoorbeeld op maandag 30 minuten, en dinsdag en vrijdag een uur matig intensief bewegen. Wandelen en fietsen zijn voorbeelden van matig intensieve activiteiten. De meeste sporten (hardlopen, voetbalwedstrijd etc.) zijn voorbeelden van intensieve activiteiten. Volg jij het advies of beweeg je meer of minder?",0,een ​​specifiek doel te stellen voor wat je wilt bereiken.
4,Gezond eten,None,"Deze leesoefening heet Gezond eten: Het kan voorkomen dat mensen die stoppen met roken, wat in gewicht aankomen. Dit komt door twee dingen. Ten eerste verhoogt roken je stofwisseling, waardoor je lichaam meer eten kan verbranden. Wanneer je stopt met roken gebruikt je lichaam minder energie en kun je dus aankomen. Je lichaam moet er even aan wennen dat het minder eten nodig heeft dan toen je nog wel rookte. Ten tweede wordt je reuk en smaak beter, waardoor je meer zin kunt hebben in eten. Daarom volgen nu tips, om niet te veel in gewicht aan te komen na het stoppen met roken. 1. Allereerst is het belangrijk om te ontbijten. Dit zorgt voor energie na de nacht en brengt de spijsvertering op gang. Kijk voor gezonde ontbijt opties hier: [https://www.voedingscentrum.nl/nl/gezonde-recepten/gezond-ontbijt-recepten.aspx]. 2. Structuur! Eet drie keer per dag. Ontbijt, middageten en avondeten. Tussen deze maaltijden door kun je nog kiezen voor gezonde tussendoortjes. Denk hierbij aan een appel, een schaaltje yoghurt, tomaatjes of een handje ongezouten nootjes. Kies wat jij lekker vindt! Ook kun je gebruik maken van eetwissels. Hiermee vervang je ongezond eten voor gezonder eten. Kijk hier voor ideeën voor eetwissels: [https://www.voedingscentrum.nl/nl/thema/eetwissel/eetwissel-inspiratie.aspx]. Welke eetwissel kies jij? 3. Drink veel water. Water is een goede keuze en is veel gezonder dan frisdrank. Ook kan een glas water je helpen om de verleiding van een ongezond tussendoortje te weerstaan. Naast water kun je ook thee en koffie zonder suiker of melk drinken. Het advies is om niet meer dan 5 kopjes koffie per dag te drinken. 4. Naast letten op je voeding, is elke dag voldoende bewegen belangrijk. Door te bewegen verbrand je namelijk calorieën. Ik ga jou de komende weken daarbij helpen. Zo kun je bijvoorbeeld de oefening 'Kies jouw sport of beweging' (nog een keer) doen om te kijken hoe je meer kunt bewegen!",0,"te leren hoe je gezond kunt eten als je stopt met roken, zodat je niet teveel aankomt in gewicht."
5,Omgeving opnieuw inrichten,None,"Deze oefening heet Omgeving opnieuw inrichten. Het aanpassen van je omgeving kan helpen bij het behalen van je beweeg doelen en bij het stoppen met roken. Als je meer wilt bewegen kun je bijvoorbeeld jouw sportkleding neerleggen op een opvallende plek (zoals naast je bed). Wanneer je wakker wordt, word je er meteen aan herinnerd om te gaan sporten. Om ervoor te zorgen dat je minder eet / gezondere hoeveelheid eet, kun je bijvoorbeeld jouw eten wegen of op een kleiner bord leggen. Je kunt ook aanpassingen doen in jouw omgeving om het stoppen met roken makkelijker te maken. Bijvoorbeeld je sigaretten en asbak weggooien zodat je ze niet elke keer ziet en er niet meer bij kan. Of je kan je kleding, beddengoed en/of gordijnen wassen. Zo verdwijnt de rookgeur en word je minder herinnerd aan roken. Denk na over wat je kunt veranderen in jouw omgeving. Schrijf dit op en pas komende dagen deze veranderingen toe. Zo help je jezelf een handje!",0,je omgeving zo in te richten dat het makkelijker wordt om niet te roken en meer te bewegen.
6, Ontspanning,None,"Deze oefening heet: Ontspanning. Zowel stoppen met roken als meer bewegen kan stressvol zijn en je een gespannen gevoel geven. Deze oefening helpt jouw spanning te verlagen. Progressieve spierontspanning is een goede manier om je lichaam te ontspannen. Wanneer we bewust onze spieren aanspannen en daarna ontspannen, helpt dit stress en spanning te verlagen. Je kan deze techniek in veel verschillende situaties toepassen. Bijvoorbeeld wanneer je zin hebt in een sigaret, tijdens een stressvolle werkdag, of na een inspannende work-out. Kijk de volgende video van 5 minuten, hierin word je stap voor stap door de oefening geleid: https://www.youtube.com/watch?v=PG1n-1cAV_0&ab_channel=ZiekenhuisGelderseValleiEde Andere opties om stress en spanning te verminderen zijn:- Meditatie, mindfulness, of andere ademhalingstechnieken. Eenvoudige video’s hierover zijn te vinden op www.youtube.com. Zoek bijvoorbeeld op ‘5 minuten mindfulness meditatie’ of ‘begeleide beginners ademhalingsoefeningen’ of ‘mindfulness lichaamsscan’. Ook kan je een mindfulness of meditatie app downloaden (bijvoorbeeld de gratis app VGZ Mindfulness coach).- Tuinieren- Puzzel maken of een boek lezen- Knutselen of iets anders creatiefs doen- Tijd besteden in de natuur- Lichte lichamelijke inspanning, zoals yoga, wandelen, of stretchen.- Of volg een training om stress te verminderen, bijvoorbeeld: https://www.snelbeterinjevel.nl/",0,stress en spanning te verlagen.
